{
  "version": 2,
  "schema_url": "https://github.com/netdata/ai-viewer/blob/master/internal/pricing/pricing.schema.json",
  "generated_at": "2026-05-27T00:00:00Z",
  "generated_by": "manual_seed (Chunk 10 initial seed; will be refreshed by scripts/refresh-pricing.sh)",
  "currency": "USD",
  "providers": [
    {
      "name": "anthropic",
      "aliases": [
        "claude"
      ],
      "models": [
        {
          "name": "claude-opus-4-7",
          "aliases": [
            "claude-opus-4.7"
          ],
          "ctx_max": 1000000,
          "tiers": [
            {
              "effective_date": "2026-01-01",
              "citation_url": "https://docs.anthropic.com/en/docs/about-claude/pricing",
              "source": "manual_seed",
              "prices": {
                "input_per_million": 5.0,
                "output_per_million": 25.0,
                "cache_read_per_million": 0.5,
                "cache_write_per_million": 6.25,
                "cache_write_5m_per_million": 6.25,
                "cache_write_1h_per_million": 10.0,
                "reasoning_per_million": 25.0
              }
            }
          ]
        },
        {
          "name": "claude-opus-4-5",
          "aliases": [
            "claude-opus-4.5"
          ],
          "ctx_max": 200000,
          "tiers": [
            {
              "effective_date": "2025-11-01",
              "citation_url": "https://docs.anthropic.com/en/docs/about-claude/pricing",
              "source": "manual_seed",
              "prices": {
                "input_per_million": 5.0,
                "output_per_million": 25.0,
                "cache_read_per_million": 0.5,
                "cache_write_per_million": 6.25,
                "cache_write_5m_per_million": 6.25,
                "cache_write_1h_per_million": 10.0
              }
            }
          ]
        },
        {
          "name": "claude-sonnet-4-5",
          "aliases": [
            "claude-sonnet-4.5",
            "claude-4-5-sonnet"
          ],
          "ctx_max": 200000,
          "tiers": [
            {
              "effective_date": "2025-10-01",
              "citation_url": "https://docs.anthropic.com/en/docs/about-claude/pricing",
              "source": "manual_seed",
              "prices": {
                "input_per_million": 3.0,
                "output_per_million": 15.0,
                "cache_read_per_million": 0.3,
                "cache_write_per_million": 3.75,
                "cache_write_5m_per_million": 3.75,
                "cache_write_1h_per_million": 6.0
              }
            }
          ]
        },
        {
          "name": "claude-sonnet-4",
          "aliases": [
            "claude-4-sonnet"
          ],
          "ctx_max": 200000,
          "tiers": [
            {
              "effective_date": "2025-05-01",
              "citation_url": "https://docs.anthropic.com/en/docs/about-claude/pricing",
              "source": "manual_seed",
              "prices": {
                "input_per_million": 3.0,
                "output_per_million": 15.0,
                "cache_read_per_million": 0.3,
                "cache_write_per_million": 3.75,
                "cache_write_5m_per_million": 3.75,
                "cache_write_1h_per_million": 6.0
              }
            }
          ]
        },
        {
          "name": "claude-haiku-4-5",
          "aliases": [
            "claude-haiku-4.5"
          ],
          "ctx_max": 200000,
          "tiers": [
            {
              "effective_date": "2025-10-01",
              "citation_url": "https://docs.anthropic.com/en/docs/about-claude/pricing",
              "source": "manual_seed",
              "prices": {
                "input_per_million": 1.0,
                "output_per_million": 5.0,
                "cache_read_per_million": 0.1,
                "cache_write_per_million": 1.25,
                "cache_write_5m_per_million": 1.25,
                "cache_write_1h_per_million": 2.0
              }
            }
          ]
        },
        {
          "name": "claude-3-7-sonnet",
          "aliases": [
            "claude-3.7-sonnet"
          ],
          "ctx_max": 200000,
          "tiers": [
            {
              "effective_date": "2025-02-01",
              "citation_url": "https://docs.anthropic.com/en/docs/about-claude/pricing",
              "source": "manual_seed",
              "prices": {
                "input_per_million": 3.0,
                "output_per_million": 15.0,
                "cache_read_per_million": 0.3,
                "cache_write_per_million": 3.75,
                "cache_write_5m_per_million": 3.75,
                "cache_write_1h_per_million": 6.0
              }
            }
          ]
        },
        {
          "name": "claude-3-5-sonnet",
          "aliases": [
            "claude-3.5-sonnet",
            "claude-3-5-sonnet-20240620",
            "claude-3-5-sonnet-20241022"
          ],
          "ctx_max": 200000,
          "tiers": [
            {
              "effective_date": "2024-06-20",
              "citation_url": "https://docs.anthropic.com/en/docs/about-claude/pricing",
              "source": "manual_seed",
              "prices": {
                "input_per_million": 3.0,
                "output_per_million": 15.0,
                "cache_read_per_million": 0.3,
                "cache_write_per_million": 3.75,
                "cache_write_5m_per_million": 3.75,
                "cache_write_1h_per_million": 6.0
              }
            }
          ]
        },
        {
          "name": "claude-3-5-haiku",
          "aliases": [
            "claude-3.5-haiku",
            "claude-3-5-haiku-20241022"
          ],
          "ctx_max": 200000,
          "tiers": [
            {
              "effective_date": "2024-11-04",
              "citation_url": "https://docs.anthropic.com/en/docs/about-claude/pricing",
              "source": "manual_seed",
              "prices": {
                "input_per_million": 0.8,
                "output_per_million": 4.0,
                "cache_read_per_million": 0.08,
                "cache_write_per_million": 1.0,
                "cache_write_5m_per_million": 1.0,
                "cache_write_1h_per_million": 1.6
              }
            }
          ]
        },
        {
          "name": "claude-opus-4-8",
          "ctx_max": 1000000,
          "tiers": [
            {
              "effective_date": "2026-01-01",
              "citation_url": "https://raw.githubusercontent.com/BerriAI/litellm/main/model_prices_and_context_window.json",
              "source": "litellm",
              "prices": {
                "input_per_million": 5.0,
                "output_per_million": 25.0,
                "cache_read_per_million": 0.5
              }
            }
          ]
        },
        {
          "name": "claude-sonnet-4-6",
          "ctx_max": 1000000,
          "tiers": [
            {
              "effective_date": "2026-01-01",
              "citation_url": "https://raw.githubusercontent.com/BerriAI/litellm/main/model_prices_and_context_window.json",
              "source": "litellm",
              "prices": {
                "input_per_million": 3.0,
                "output_per_million": 15.0,
                "cache_read_per_million": 0.3
              }
            }
          ]
        },
        {
          "name": "claude-fable-5",
          "ctx_max": 1000000,
          "tiers": [
            {
              "effective_date": "2026-01-01",
              "citation_url": "https://raw.githubusercontent.com/BerriAI/litellm/main/model_prices_and_context_window.json",
              "source": "litellm",
              "prices": {
                "input_per_million": 10.0,
                "output_per_million": 50.0,
                "cache_read_per_million": 1.0
              }
            }
          ]
        }
      ]
    },
    {
      "name": "openai",
      "aliases": [
        "oai"
      ],
      "models": [
        {
          "name": "gpt-5",
          "aliases": [
            "gpt5"
          ],
          "ctx_max": 400000,
          "tiers": [
            {
              "effective_date": "2025-08-01",
              "citation_url": "https://openai.com/api/pricing/",
              "source": "manual_seed",
              "prices": {
                "input_per_million": 1.25,
                "output_per_million": 10.0,
                "cache_read_per_million": 0.125,
                "reasoning_per_million": 10.0
              }
            }
          ]
        },
        {
          "name": "gpt-5-mini",
          "aliases": [
            "gpt5-mini"
          ],
          "ctx_max": 400000,
          "tiers": [
            {
              "effective_date": "2025-08-01",
              "citation_url": "https://openai.com/api/pricing/",
              "source": "manual_seed",
              "prices": {
                "input_per_million": 0.25,
                "output_per_million": 2.0,
                "cache_read_per_million": 0.025,
                "reasoning_per_million": 2.0
              }
            }
          ]
        },
        {
          "name": "gpt-4o",
          "aliases": [
            "gpt4o",
            "gpt-4o-2024-08-06"
          ],
          "ctx_max": 128000,
          "tiers": [
            {
              "effective_date": "2024-08-06",
              "citation_url": "https://openai.com/api/pricing/",
              "source": "manual_seed",
              "prices": {
                "input_per_million": 2.5,
                "output_per_million": 10.0,
                "cache_read_per_million": 1.25
              }
            }
          ]
        },
        {
          "name": "gpt-4-turbo",
          "aliases": [
            "gpt-4-turbo-2024-04-09"
          ],
          "ctx_max": 128000,
          "tiers": [
            {
              "effective_date": "2024-04-09",